"Little Brother", "5.5", "11063", "https://www.imdb.com/title/tt34888871/", "https://m.media-amazon.com/images/M/MV5BNDVmOWNhNWYtM2Y1MS00MWFjLTlkNTctMTRkNmMxM2UwODZlXkEyXkFqcGc@._V1_.jpg", "A famous real estate agent&apos;s life is disrupted when his eccentric little brother unexpectedly reappears.", "Comedy", "102", "R", "female nudity, outdoor nudity, male full frontal nudity, sex scene, buddy comedy", "US", "42", "DOWN 22", "Matt Spicer", "Jarrad Paul, Andrew Mogel", "John Cena, Eric André, Michelle Monaghan", "John Cena, Eric André, Michelle Monaghan, Christopher Meloni", "", "", "", "", "New York City, New York, USA", "English", "Dolby Atmos", "1.85 : 1", "Color", "0", "0", "Movie", "False", "False", "False"
"The Rip", "6.8", "137054", "https://www.imdb.com/title/tt32642706/", "https://m.media-amazon.com/images/M/MV5BNjIzMGY3MzMtNDVlMS00MGU1LTkyNTItMmI4Mzk0Mjg3OTBkXkEyXkFqcGc@._V1_.jpg", "A group of Miami cops discovers a stash of millions in cash, leading to distrust as outsiders learn about the huge seizure, making them question who to rely on.", "Action, Crime, Drama", "113", "R", "dog, two word title, asian man, text message, friday", "US", "93", "UP 62", "Joe Carnahan", "Joe Carnahan, Michael McGrale", "Matt Damon, Ben Affleck, Steven Yeun", "Matt Damon, Ben Affleck, Steven Yeun, Teyana Taylor", "", "", "", "", "Miami, Florida, USA", "English", "Dolby Atmos", "2.39 : 1", "Color", "0", "4", "Movie", "False", "False", "False"
"Gail Daughtry and the Celebrity Sex Pass", "6.8", "1231", "https://www.imdb.com/title/tt36834010/", "https://m.media-amazon.com/images/M/MV5BZTFjOGJhNzEtMWUxMC00Yjc1LWE1MTUtODc4Yzk3MzVjMWUyXkEyXkFqcGc@._V1_.jpg", "When her fiancé uses their &quot;celebrity pass&quot; agreement, Midwest bride Gail Daughtry travels to Hollywood seeking revenge by pursuing her own celebrity encounter.", "Comedy", "94", "R", "", "US", "94", "DOWN 56", "David Wain", "Ken Marino, David Wain", "Fred Melamed, Zoey Deutch, Michael Cassidy", "Fred Melamed, Zoey Deutch, Michael Cassidy, Miles Gutierrez-Riley", "", "USD 898,962", "USD 1,338,057", "USD 1,338,057", "Santa Clarita, California, USA", "English", "", "", "Color", "0", "0", "Movie", "False", "False", "False"
"Reminders of Him", "6.3", "10436", "https://www.imdb.com/title/tt33714084/", "https://m.media-amazon.com/images/M/MV5BNjI4OGM1NDEtYzA1NS00ZDg3LWFmZjUtMjg1MGQ4MTk3NjQzXkEyXkFqcGc@._V1_.jpg", "After prison, a woman attempts to reconnect with her young daughter but faces resistance from everyone except a bar owner with ties to her child. As they grow closer, she must confront her past mistakes to build a hopeful future.", "Drama, Romance", "114", "PG-13", "male rear nudity, male nudity, contemporary romance, 2020s movie, contemporary", "US", "95", "DOWN 19", "Vanessa Caswill", "Lauren Levine, Colleen Hoover", "Maika Monroe, Tyriq Withers, Zoe Kosovic", "Maika Monroe, Tyriq Withers, Zoe Kosovic, Lauren Graham", "", "USD 17,979,940", "USD 48,559,430", "USD 89,087,873", "Calgary, Alberta, Canada", "English, Spanish", "Dolby Atmos, SDDS, DTS:X", "2.39 : 1", "Color", "1", "0", "Movie", "False", "False", "False"
"Nuremberg", "7.3", "107768", "https://www.imdb.com/title/tt29567915/", "https://m.media-amazon.com/images/M/MV5BMWUzODNkYWUtMmMzOC00NzZjLTlkMTctOTkwM2I2ZWI1MTlmXkEyXkFqcGc@._V1_.jpg", "A WWII psychiatrist evaluates Nazi leaders before the Nuremberg trials, growing increasingly obsessed with understanding evil as he forms a disturbing bond with Hermann Göring.", "Biography, Drama, History", "148", "PG-13", "nuremberg trials, luxembourg, man urinates outside, year 1947, man touches a man", "HU", "94", "DOWN 18", "James Vanderbilt", "James Vanderbilt, Jack El-Hai", "Rami Malek, Russell Crowe, Michael Shannon", "Rami Malek, Russell Crowe, Michael Shannon, Leo Woodall", "", "USD 3,883,295", "USD 14,524,693", "USD 70,531,391", "Duna Palota, Budapest, Hungary", "English, German", "Dolby Atmos", "2.39 : 1", "Color", "4", "20", "Movie", "False", "False", "False"
"Over Your Dead Body", "6.3", "25467", "https://www.imdb.com/title/tt34685692/", "https://m.media-amazon.com/images/M/MV5BMWU2M2YyNTMtZGM4ZC00MDcwLWI3NmItZWM0YjIyOTEyNDZhXkEyXkFqcGc@._V1_.jpg", "A dysfunctional married couple retreats to a secluded cabin to repair their relationship, but each secretly plots to murder the other.", "Action, Comedy, Thriller", "105", "R", "dark comedy, lawnmower, red pepper corn, eating a steak, reference to idaho", "US", "60", "DOWN 8", "Jorma Taccone", "Tommy Wirkola, Nick Ball, John Niven", "Samara Weaving, Jason Segel, Timothy Olyphant", "Samara Weaving, Jason Segel, Timothy Olyphant, Nikolai Kinski", "", "USD 1,393,356", "USD 2,154,696", "USD 2,443,515", "Tampere, Finland", "English", "Dolby Digital", "2.39 : 1", "Color", "1", "1", "Movie", "False", "False", "False"
"Avatar Aang: The Last Airbender", "0", "0", "https://www.imdb.com/title/tt18259538/", "https://m.media-amazon.com/images/M/MV5BZGQzMzIzODAtZjc5Ni00ODRkLTlhMzMtNTVkOTI4MjBhNWEyXkEyXkFqcGc@._V1_.jpg", "Avatar Aang, the world&apos;s last Airbender, learns of an ancient power that could save his culture from extinction. With the help of his friends, he embarks on a global quest to find it before it falls into the wrong hands.", "Animation, Action, Adventure", "99", "PG", "aang character, based on tv series, number 1 in title, digit in title, number in title", "US", "36", "UP 59", "", "Kenneth Lin, Michael Dante DiMartino, Tim Hedrick", "Eric Nam, Dave Bautista, Jessica Matten", "Eric Nam, Dave Bautista, Jessica Matten, Román Zaragoza", "", "", "", "", "Sydney, New South Wales, Australia", "English", "Dolby Digital, Dolby Atmos, IMAX 5.0", "2.35 : 1", "Color", "0", "0", "Movie", "False", "False", "False"
"Bugonia", "7.4", "209536", "https://www.imdb.com/title/tt12300742/", "https://m.media-amazon.com/images/M/MV5BNzIzNWQxMjEtZmQ3MS00OTk2LWFlZjktZDUyYWRkM2M3NWVlXkEyXkFqcGc@._V1_.jpg", "Two conspiracy-obsessed young men kidnap the high-powered CEO of a major company, convinced that she is an alien intent on destroying planet Earth.", "Comedy, Crime, Sci-Fi", "118", "R", "kidnapping, conspiracy, remake, chained in basement, dark comedy", "IE", "73", "DOWN 19", "Yorgos Lanthimos", "Will Tracy, Jang Joon-hwan", "Emma Stone, Jesse Plemons, Aidan Delbis", "Emma Stone, Jesse Plemons, Aidan Delbis, J. Carmen Galindez Barrera", "", "USD 709,848", "USD 17,692,390", "USD 43,523,384", "Sarakiniko Beach, Milos Island, Greece", "English", "Dolby Digital, 12-Track Digital Sound, Dolby Atmos", "1.50 : 1", "Color", "12", "147", "Movie", "False", "False", "False"
"The Dark Knight Rises", "8.4", "2007294", "https://www.imdb.com/title/tt1345836/", "https://m.media-amazon.com/images/M/MV5BMTk4ODQzNDY3Ml5BMl5BanBnXkFtZTcwODA0NTM4Nw@@._V1_.jpg", "Bane, an imposing terrorist, attacks Gotham City and disrupts its eight-year-long period of peace. This forces Bruce Wayne to come out of hiding and don the cape and cowl of Batman again.", "Crime, Thriller", "164", "PG-13", "terrorist plot, batman character, bruce wayne character, motorcycle, warlord", "GB", "100", "UP 101", "Christopher Nolan", "Jonathan Nolan, Christopher Nolan, David S. Goyer", "Christian Bale, Tom Hardy, Anne Hathaway", "Christian Bale, Tom Hardy, Anne Hathaway, Gary Oldman", "USD 250,000,000", "USD 160,887,295", "USD 448,149,584", "USD 1,085,429,532", "Mehrangarh Fort, Jodhpur, Rajasthan, India", "English, Arabic", "SDDS, Datasat, Dolby Digital, IMAX 6-Track", "", "Color", "45", "104", "Movie", "False", "False", "False"
