"F1", "7.6", "367202", "https://www.imdb.com/title/tt16311594/", "https://m.media-amazon.com/images/M/MV5BNGI0MDI4NjEtOWU3ZS00ODQyLWFhYTgtNGYxM2ZkM2Q2YjE3XkEyXkFqcGc@._V1_.jpg", "A Formula One driver comes out of retirement to mentor and team up with a younger driver.", "Drama, Sport", "155", "PG-13", "motorsport, racing, formula 1, driver, race car driver", "US", "100", "DOWN 20", "Joseph Kosinski", "Joseph Kosinski, Ehren Kruger", "Brad Pitt, Damson Idris, Javier Bardem", "Brad Pitt, Damson Idris, Javier Bardem, Kerry Condon", "USD 200,000,000", "USD 57,001,667", "USD 189,642,436", "USD 634,142,436", "Hungaroring, Budapest, Hungary", "English, Spanish, German, Italian", "Dolby Atmos, IMAX 6-Track, 12-Track Digital Sound, DTS:X, Sonics-DDP, SDDS, Auro 11.1, Dolby Surround 7.1, Dolby Digital", "2.39 : 1", "Color", "32", "129", "Movie", "False", "False", "False"
"One Night Only", "0", "0", "https://www.imdb.com/title/tt37853455/", "https://m.media-amazon.com/images/M/MV5BMjQ5MmMxMjItNWQ5NC00OGI1LWFjNTYtYjA3NjNmM2EzNmIyXkEyXkFqcGc@._V1_.jpg", "Two New Yorkers search for love on the one night of the year when sex is legal.", "Comedy, Drama, Romance", "0", "R", "romantic comedy", "US", "94", "UP 264", "Will Gluck", "Travis Braun, Will Gluck", "Callum Turner, Monica Barbaro, Maya Hawke", "Callum Turner, Monica Barbaro, Maya Hawke, Michelle Hurd", "", "", "", "", "New York City, New York, USA", "English", "", "", "Color", "0", "0", "Movie", "False", "False", "False"
"Superman", "7", "418762", "https://www.imdb.com/title/tt5950044/", "https://m.media-amazon.com/images/M/MV5BOGMwZGJiM2EtMzEwZC00YTYzLWIxNzYtMmJmZWNlZjgxZTMwXkEyXkFqcGc@._V1_.jpg", "Superman must reconcile his alien Kryptonian heritage with his human upbringing as reporter Clark Kent. As the embodiment of truth, justice and the American way he soon finds himself in a world that views these as old-fashioned.", "Action, Adventure, Sci-Fi", "129", "PG-13", "superhero, hero, dc universe, alien, comicbook movie", "US", "95", "DOWN 3", "James Gunn", "James Gunn, Jerry Siegel, Joe Shuster", "David Corenswet, Rachel Brosnahan, Nicholas Hoult", "David Corenswet, Rachel Brosnahan, Nicholas Hoult, Alan Tudyk", "USD 225,000,000", "USD 125,021,735", "USD 354,223,803", "USD 618,723,803", "Cincinnati, Ohio, USA", "English", "Dolby Atmos, IMAX 6-Track, DTS:X, 12-Track Digital Sound, SDDS, Dolby Surround 7.1, Auro 11.1", "1.85 : 1", "Color", "5", "75", "Movie", "False", "False", "False"
"Mortal Kombat", "6.1", "215011", "https://www.imdb.com/title/tt0293429/", "https://m.media-amazon.com/images/M/MV5BNmRmN2I5M2EtNDA1Ny00N2ZmLWE3YWYtMjQ1NTFjY2Q4NWM5XkEyXkFqcGc@._V1_.jpg", "MMA fighter Cole Young seeks out Earth&apos;s greatest champions in order to stand against the enemies of Outworld in a high stakes battle for the universe.", "Action, Adventure, Fantasy", "110", "R", "based on video game, gore, mortal kombat, reboot, two word title", "US", "96", "UP 89", "Simon McQuoid", "Greg Russo, Dave Callaham, Oren Uziel", "Lewis Tan, Jessica McNamee, Josh Lawson", "Lewis Tan, Jessica McNamee, Josh Lawson, Joe Taslim", "USD 55,000,000", "USD 23,302,503", "USD 42,326,031", "USD 84,426,031", "Port Adelaide, South Australia, Australia", "English, Japanese, Chinese", "Dolby Atmos, Dolby Digital, IMAX 6-Track, Auro 11.1, Dolby Surround 7.1", "2.39 : 1", "Color", "4", "10", "Movie", "False", "False", "False"
"War Machine", "6.3", "103448", "https://www.imdb.com/title/tt15940132/", "https://m.media-amazon.com/images/M/MV5BMmM1ZTc5ZTYtOTM2My00MjBmLWE5NzktYzkyYzdlYWE3ZDAzXkEyXkFqcGc@._V1_.jpg", "Follow the final recruits of a grueling special ops boot camp who encounter a mysterious deadly force.", "Action, Sci-Fi, Thriller", "106", "R", "u.s. army rangers, team action, army rangers, loss of brother, american soldier", "GB", "96", "DOWN 20", "Patrick Hughes", "Patrick Hughes, James Beaufort", "Alan Ritchson, Stephan James, Blake Richardson", "Alan Ritchson, Stephan James, Blake Richardson, Dennis Quaid", "", "", "", "USD 56,984", "Melbourne, Victoria, Australia", "English", "Dolby Atmos", "2.39 : 1", "Color", "0", "1", "Movie", "False", "False", "False"
"The Running Man", "6.4", "110486", "https://www.imdb.com/title/tt14107334/", "https://m.media-amazon.com/images/M/MV5BMTk5NjU4OTAtNTEyMS00ZjBiLTg0ZjMtOGJiMGJhNjQ3MzYxXkEyXkFqcGc@._V1_.jpg", "A man joins a game show in which contestants, allowed to flee anywhere in the world, are pursued by &quot;hunters&quot; hired to kill them.", "Action, Adventure, Sci-Fi", "133", "R", "dystopia, dystopian sci fi, fictional game show, survival, fictional reality tv show", "GB", "79", "DOWN 16", "Edgar Wright", "Stephen King, Michael Bacall, Edgar Wright", "Glen Powell, Alyssa Benn, Sienna Benn", "Glen Powell, Alyssa Benn, Sienna Benn, David Zayas", "USD 110,000,000", "USD 16,495,564", "USD 37,815,641", "USD 69,486,523", "Bulgaria", "English", "Dolby Atmos, Dolby Digital, DTS:X, 12-Track Digital Sound, IMAX 6-Track", "2.39 : 1", "Color", "0", "10", "Movie", "False", "False", "False"
"Inception", "8.8", "2825476", "https://www.imdb.com/title/tt1375666/", "https://m.media-amazon.com/images/M/MV5BMjAxMzY3NjcxNF5BMl5BanBnXkFtZTcwNTI5OTM0Mw@@._V1_.jpg", "A thief who steals corporate secrets through the use of dream-sharing technology is given the inverse task of planting an idea into the mind of a CEO, but his tragic past may doom the project and his team to disaster.", "Adventure, Sci-Fi, Thriller", "148", "PG-13", "dream, ambiguous ending, subconscious, surprise ending, mindbender", "GB", "97", "DOWN 10", "Christopher Nolan", "", "Leonardo DiCaprio, Joseph Gordon-Levitt, Elliot Page", "Leonardo DiCaprio, Joseph Gordon-Levitt, Elliot Page, Tom Hardy", "USD 160,000,000", "USD 62,785,337", "USD 292,587,330", "USD 839,796,627", "Fortress Mountain, Kananaskis Country, Alberta, Canada", "English, Japanese, French", "Dolby Digital, DTS, SDDS", "2.39 : 1", "Color", "160", "220", "Movie", "False", "False", "False"
"Signal One", "5.5", "967", "https://www.imdb.com/title/tt21109170/", "https://m.media-amazon.com/images/M/MV5BZDk1MjU4NWYtZGQ2Ni00MjcxLTliNTEtYzAzZGQzNDNkYjcwXkEyXkFqcGc@._V1_.jpg", "It tells the story of a computer scientist who is recruited by a tech billionaire to work on a project that could change humanity&apos;s place in the universe.", "Mystery, Sci-Fi", "87", "", "", "CA", "100", "DOWN 22", "Jonathan Sobol", "", "Isabelle Fuhrman, Dennis Quaid, David Thewlis", "Isabelle Fuhrman, Dennis Quaid, David Thewlis, Josh Hutcherson", "", "", "", "", "Cayman Islands", "English", "", "", "Color", "0", "0", "Movie", "False", "False", "False"
