name, rating, votes, link, image, plot, genres, runtime, certificate, keywords, countriesOfOrigin, meterRanking, meterRankChange, directors, writers, stars, topCast, budget, openingWeekendGross, lifetimeGross, worldwideGross, filmingLocations, spokenLanguages, soundMix, aspectRatio, color, awardWins, awardNominations, titleType, isSeries, isEpisode, isAdult

"Disclosure Day", "6.8", "32927", "https://www.imdb.com/title/tt15047880/", "https://m.media-amazon.com/images/M/MV5BMTgwNDI1ZjctYWNmMS00MTJhLTg1ZWItMzI1Yjk5NjZkYWFkXkEyXkFqcGc@._V1_.jpg", "If you found out we weren&apos;t alone, if someone showed you, proved it to you, would that frighten you?", "Action, Drama, Mystery", "145", "PG-13", "alien invasion sci fi, supernatural fantasy, suspense mystery, cosmic horror, extreme close up of eyes", "US", "8", "UP 2", "Steven Spielberg", "David Koepp, Steven Spielberg", "Emily Blunt, Josh O'Connor, Colin Firth", "Emily Blunt, Josh O'Connor, Colin Firth, Eve Hewson", "", "", "", "", "New Jersey, USA", "English", "70 mm 6-Track, Dolby Atmos, Dolby Surround 5.1, IMAX 6-Track, Dolby Surround 7.1", "2.39 : 1", "Color", "0", "3", "Movie", "False", "False", "False"
"Obsession", "8.1", "94223", "https://www.imdb.com/title/tt37287335/", "https://m.media-amazon.com/images/M/MV5BYzc1NWUwMDgtNGZlMS00ZmYzLWIzMzktNmMxMmY1MTUzNWExXkEyXkFqcGc@._V1_.jpg", "After breaking the mysterious &quot;One Wish Willow&quot; to win his crush&apos;s heart, a hopeless romantic finds himself getting exactly what he asked for but soon discovers that some desires come at a dark, sinister price.", "Horror, Romance, Thriller", "108", "R", "crush, wish, death of cat, male rear nudity, male nudity", "US", "1", "UP 1", "Curry Barker", "", "Michael Johnston, Inde Navarrette, Cooper Tomlinson", "Michael Johnston, Inde Navarrette, Cooper Tomlinson, Megan Lawless", "USD 750,000", "USD 17,196,855", "USD 156,133,260", "USD 229,414,260", "Los Angeles, California, USA", "English", "D-Cinema 48kHz 5.1, Dolby Atmos, Dolby Digital", "1.50 : 1", "Color", "5", "4", "Movie", "False", "False", "False"
"Backrooms", "7.1", "67504", "https://www.imdb.com/title/tt26657236/", "https://m.media-amazon.com/images/M/MV5BYzQyYjZmMjctMzIyZi00MDI0LWJhNGQtMzQ3MTFlNDgwNGM5XkEyXkFqcGc@._V1_.jpg", "After a therapist&apos;s patient disappears into a dimension beyond reality, she must venture into the unknown to save him.", "Horror, Sci-Fi, Thriller", "110", "R", "creepypasta, psychological horror, backrooms, found footage horror, analog horror", "US", "2", "DOWN 1", "Kane Parsons", "Will Soodik, Kane Parsons", "Chiwetel Ejiofor, Renate Reinsve, Mark Duplass", "Chiwetel Ejiofor, Renate Reinsve, Mark Duplass, Finn Bennett", "USD 10,000,000", "USD 81,402,424", "USD 138,661,974", "USD 216,261,974", "15 King Edward Street, Coquitlam, British Columbia, Canada", "English, Portuguese, Turkish, Arabic, Japanese", "Dolby Atmos", "1.85 : 1", "Color", "0", "0", "Movie", "False", "False", "False"
"Masters of the Universe", "7.1", "25990", "https://www.imdb.com/title/tt0427340/", "https://m.media-amazon.com/images/M/MV5BMTJjYTFkM2EtZjBmNy00OTk2LTg0NTAtNzYxYzlmNjhkMzQ5XkEyXkFqcGc@._V1_.jpg", "A young man on Earth discovers a fabulous secret legacy as the prince of an alien planet, and must recover a magic sword and return home to protect his kingdom.", "Action, Adventure, Fantasy", "140", "PG-13", "masters of the universe, beefcake, superhero, magical sword, prince", "US", "3", "UP 9", "Travis Knight", "Chris Butler, Aaron Nee, Adam Nee", "Nicholas Galitzine, Camila Mendes, Idris Elba", "Nicholas Galitzine, Camila Mendes, Idris Elba, Jared Leto", "", "USD 29,439,929", "USD 31,538,352", "USD 56,538,352", "London, England, UK", "English", "Dolby Atmos, Dolby Digital, IMAX 6-Track", "2.39 : 1", "Color", "0", "0", "Movie", "False", "False", "False"
"Michael", "7.6", "124669", "https://www.imdb.com/title/tt11378946/", "https://m.media-amazon.com/images/M/MV5BNzllNmRlN2EtMDQyOC00ODJjLTg4OWQtZDNmNGU3YzlkNjc1XkEyXkFqcGc@._V1_.jpg", "The early life of musician Michael Jackson, from the discovery of his talent as the lead of the Jackson Five to the artist whose creative ambition fueled a pursuit to become the biggest entertainer in the world.", "Biography, Drama, History", "127", "PG-13", "michael jackson character, king of pop, based on true story, song, based on real people", "US", "6", "DOWN 2", "Antoine Fuqua", "", "Jaafar Jackson, Nia Long, Colman Domingo", "Jaafar Jackson, Nia Long, Colman Domingo, Juliano Valdi", "USD 155,000,000", "USD 97,206,874", "USD 355,266,918", "USD 889,366,918", "Sony Pictures Studios - 10202 W. Washington Blvd., Culver City, California, USA", "English", "Dolby Digital, IMAX 6-Track, IMAX 5.0, Dolby Atmos, Dolby Surround 7.1", "1.85 : 1", "Color", "2", "4", "Movie", "False", "False", "False"
"Scary Movie", "5.4", "20393", "https://www.imdb.com/title/tt32093575/", "https://m.media-amazon.com/images/M/MV5BNTJjMDk1NzAtMGVmNS00NTFmLWFlOTQtZDk5M2I2NjZiZDdlXkEyXkFqcGc@._V1_.jpg", "Two friends find themselves caught up in mayhem involving killers, monsters and supernatural creatures once again.", "Comedy, Horror", "96", "R", "crude humor comedy, slasher horror, criticism to republican party, pubic hair, diaper wearing woman", "US", "4", "UP 23", "Michael Tiddes", "Shawn Wayans, Marlon Wayans, Buddy Johnson", "Marlon Wayans, Shawn Wayans, Anna Faris", "Marlon Wayans, Shawn Wayans, Anna Faris, Regina Hall", "USD 30,000,000", "USD 54,336,626", "USD 58,464,337", "USD 113,498,241", "Tyler Perry Studios, Atlanta, Georgia, USA", "English", "Dolby Digital, Dolby Atmos", "2.39 : 1", "Color", "0", "1", "Movie", "False", "False", "False"
"Heart of the Beast", "0", "0", "https://www.imdb.com/title/tt7526136/", "https://m.media-amazon.com/images/M/MV5BMDVlMTRhMjgtMjdmZi00NjJhLWExMmYtODExNWJkZGZjNjdhXkEyXkFqcGc@._V1_.jpg", "After a harrowing plane crash, a Special Forces officer and his combat dog find themselves stranded deep in the Alaskan wilderness. Together, they are forced into a brutal fight for survival against the elements.", "Action, Adventure, Drama", "0", "", "dog, special forces soldier, army special forces soldier, alaska, combat dog", "US", "7", "UP 3324", "David Ayer", "", "Brad Pitt, J.K. Simmons, Anna Lambe", "Brad Pitt, J.K. Simmons, Anna Lambe", "", "", "", "", "New Zealand", "English", "", "2.39 : 1", "Color", "0", "0", "Movie", "False", "False", "False"
"Office Romance", "5.9", "13127", "https://www.imdb.com/title/tt33397980/", "https://m.media-amazon.com/images/M/MV5BZmM0MDlhOTMtNjYxYy00MGI4LWEwODQtZTEyOTFhZTUyMTllXkEyXkFqcGc@._V1_.jpg", "Jackie, President and CEO of Air Cruz, runs a tight ship in her business, including a rigid anti-fraternization policy for all her employees, which is severely tested when a sexy new lawyer begins working for her.", "Comedy, Romance", "114", "R", "male nudity, covered male frontal nudity, erection, romantic comedy, employer employee relationship", "US", "8", "DOWN 3", "Ol Parker", "Brett Goldstein, Joe Kelly", "Jennifer Lopez, Brett Goldstein, Betty Gilpin", "Jennifer Lopez, Brett Goldstein, Betty Gilpin, Edward James Olmos", "", "", "", "", "Kenilworth, New Jersey, USA", "English", "Dolby Digital, Dolby Atmos", "2.35 : 1, 2.39 : 1", "Color", "0", "0", "Movie", "False", "False", "False"
"Project Hail Mary", "8.3", "355732", "https://www.imdb.com/title/tt12042730/", "https://m.media-amazon.com/images/M/MV5BNTkwNzJiYTctNzI3NC00NjE1LTlhYjktY2Q5MTdmMWFmNzcxXkEyXkFqcGc@._V1_.jpg", "A science teacher wakes up alone on a spaceship. As his memory returns, he uncovers a mission to stop a mysterious substance killing Earth&apos;s sun, and realizes that an unexpected friendship may be the key.", "Adventure, Comedy, Drama", "156", "PG-13", "outer space, alien, space sci fi, astronaut, teacher", "US", "9", "DOWN 3", "", "Drew Goddard, Andy Weir", "Ryan Gosling, Sandra Hüller, James Ortiz", "Ryan Gosling, Sandra Hüller, James Ortiz, Lionel Boyce", "USD 200,000,000", "USD 80,506,007", "USD 343,403,886", "USD 680,212,034", "South Parade Pier, Southsea, Portsmouth, Hampshire, England, UK", "English", "Dolby Atmos, IMAX 6-Track, Dolby Digital", "2.00 : 1", "Color", "1", "5", "Movie", "False", "False", "False"
"The Odyssey", "0", "0", "https://www.imdb.com/title/tt33764258/", "https://m.media-amazon.com/images/M/MV5BZDY2NTkxMWQtMmNkMC00NmNjLWIzMmItNmEyMmRmMDk2YmY2XkEyXkFqcGc@._V1_.jpg", "After the Trojan War, Odysseus faces a dangerous voyage back to Ithaca, meeting creatures like the Cyclops Polyphemus, Sirens, and Calypso along the way.", "Adventure, Drama, Fantasy", "172", "R", "ancient greece, greek, based on epic poem, epic poem, odysseus character", "GB", "13", "UP 11", "Christopher Nolan", "Christopher Nolan, Homer", "Matt Damon, Tom Holland, Anne Hathaway", "Matt Damon, Tom Holland, Anne Hathaway, Robert Pattinson", "USD 250,000,000", "", "", "", "Messinia, Peloponnese region, Greece", "English", "IMAX 6-Track, Dolby Atmos, Dolby Surround 7.1, Dolby Surround 5.1, Dolby Digital", "", "Color", "0", "0", "Movie", "False", "False", "False"
"They Will Kill You", "6.3", "29217", "https://www.imdb.com/title/tt31728330/", "https://m.media-amazon.com/images/M/MV5BODIzZGNhNGUtOWM2My00ODM4LThmOWQtNTkzMzYwMTZhYzU1XkEyXkFqcGc@._V1_.jpg", "A woman takes a job as a housekeeper in a NYC high-rise, unaware of the building&apos;s history of disappearances. She soon realizes the community is shrouded in mystery.", "Action, Comedy, Horror", "94", "R", "one person army action, splatter horror, dark comedy, satanism, satanic cult", "ZA", "11", "UP 94", "Kirill Sokolov", "Kirill Sokolov, Alex Litvak", "Zazie Beetz, Patricia Arquette, Myha'la", "Zazie Beetz, Patricia Arquette, Myha'la, Paterson Joseph", "USD 20,000,000", "USD 4,970,938", "USD 10,882,152", "USD 19,382,152", "Cape Town, South Africa", "English", "Dolby Digital, Dolby Atmos", "2.20 : 1", "Color", "0", "1", "Movie", "False", "False", "False"
"Mortal Kombat II", "6.5", "48207", "https://www.imdb.com/title/tt17490712/", "https://m.media-amazon.com/images/M/MV5BNTg2YWNkN2EtMzc1Ny00ZTBhLWFmYTItMmMyNzhjNjhhNmVhXkEyXkFqcGc@._V1_.jpg", "The fan favorite champions -- now joined by Johnny Cage himself -- are pitted against one another in the ultimate battle to defeat the dark rule of Shao Kahn that threatens the very existence of the Earthrealm and its defenders.", "Action, Adventure, Fantasy", "116", "R", "mortal kombat, based on video game, martial arts, dark fantasy, sequel", "US", "23", "DOWN 9", "Simon McQuoid", "Jeremy Slater, Ed Boon, John Tobias", "Adeline Rudolph, Karl Urban, Martyn Ford", "Adeline Rudolph, Karl Urban, Martyn Ford, Tati Gabrielle", "USD 68,000,000", "USD 38,501,177", "USD 79,168,053", "USD 128,068,053", "Village Roadshow Studios, Oxenford, Queensland, Australia", "English, Spanish", "Dolby Digital, Dolby Surround 7.1, IMAX 6-Track, Auro 11.1, Dolby Atmos", "2.39 : 1", "Color", "0", "0", "Movie", "False", "False", "False"
"Over Your Dead Body", "6.3", "13868", "https://www.imdb.com/title/tt34685692/", "https://m.media-amazon.com/images/M/MV5BMWU2M2YyNTMtZGM4ZC00MDcwLWI3NmItZWM0YjIyOTEyNDZhXkEyXkFqcGc@._V1_.jpg", "A dysfunctional married couple retreats to a secluded cabin to repair their relationship, but each secretly plots to murder the other.", "Action, Comedy, Thriller", "105", "R", "dark comedy, lawnmower, red pepper corn, eating a steak, reference to idaho", "US", "33", "DOWN 18", "Jorma Taccone", "Tommy Wirkola, Nick Ball, John Niven", "Samara Weaving, Jason Segel, Timothy Olyphant", "Samara Weaving, Jason Segel, Timothy Olyphant, Nikolai Kinski", "", "USD 1,393,356", "USD 2,154,696", "USD 2,443,515", "Tampere, Finland", "English", "", "", "Color", "1", "0", "Movie", "False", "False", "False"
"Hoppers", "7.3", "60828", "https://www.imdb.com/title/tt26443616/", "https://m.media-amazon.com/images/M/MV5BNzRiMzZlMTMtNmU3OC00MDUwLThmNDUtMTBjZmQ3MWQ4NTljXkEyXkFqcGc@._V1_.jpg", "A 19-year-old animal lover uses technology that places her consciousness into a robotic beaver to uncover mysteries within the animal world beyond her imagination.", "Animation, Adventure, Comedy", "104", "PG", "robot, nature lover, soul transference, beaver, scientist", "US", "7", "UP 64", "Daniel Chong", "Jesse Andrews, Daniel Chong, Jordan Harrison", "Piper Curda, Bobby Moynihan, Jon Hamm", "Piper Curda, Bobby Moynihan, Jon Hamm, Kathy Najimy", "USD 150,000,000", "USD 45,349,801", "USD 166,010,783", "USD 372,010,783", "", "English", "Dolby Digital, DTS:X, IMAX 6-Track, Dolby Atmos, Dolby Surround 7.1", "1.85 : 1", "Color", "0", "1", "Movie", "False", "False", "False"
"Toy Story 5", "0", "0", "https://www.imdb.com/title/tt29355505/", "https://m.media-amazon.com/images/M/MV5BZTI1YTBiNmEtYWUxZi00YzFkLWIzNjMtMmZjMmY2NzM0ZWMzXkEyXkFqcGc@._V1_.jpg", "Woody, Buzz, Jessie and the rest of the gang&apos;s jobs are challenged when they&apos;re introduced to electronics, a new threat to playtime.", "Animation, Adventure, Comedy", "102", "PG", "sequel, talking toy, buzz lightyear character, dinosaur, cowboy toy", "US", "25", "UP 7", "", "Andrew Stanton, McKenna Harris", "Tom Hanks, Keanu Reeves, Alan Cumming", "Tom Hanks, Keanu Reeves, Alan Cumming, Joan Cusack", "", "", "", "", "Pixar Animation Studios - 1200 Park Avenue, Emeryville, California, USA", "English", "Sonics-DDP, Auro 11.1, D-Cinema 96kHz Dolby Surround 7.1, Dolby Atmos, Dolby Digital, 12-Track Digital Sound, Dolby Surround 7.1, D-Cinema 96kHz 7.1, DTS:X", "1.85 : 1", "", "0", "2", "Movie", "False", "False", "False"
"In the Grey", "6.3", "18761", "https://www.imdb.com/title/tt27681354/", "https://m.media-amazon.com/images/M/MV5BMTZkMTIzMTItMTQwZS00MTg4LWE0MTEtM2NiNmUzYjRmMGUxXkEyXkFqcGc@._V1_.jpg", "A covert team of elite operatives are living in the shadows. When a ruthless despot steals a billion-dollar fortune, they&apos;re sent to take it back-an impossible heist that erupts into a deadly game of strategy, deception and survival.", "Action, Drama, Thriller", "98", "R", "escape, jeddah saudi arabia, flashback, asset seizure, slow motion shot", "GB", "12", "UP 28", "Guy Ritchie", "", "Henry Cavill, Jake Gyllenhaal, Eiza González", "Henry Cavill, Jake Gyllenhaal, Eiza González, Carlos Bardem", "", "USD 2,926,879", "USD 5,723,890", "USD 17,339,364", "Tenerife, Canary Islands, Spain", "English", "Dolby Atmos, Dolby Digital", "2.39 : 1", "Color", "0", "0", "Movie", "False", "False", "False"
"Huo zhe yan", "7.9", "2465", "https://www.imdb.com/title/tt33311069/", "https://m.media-amazon.com/images/M/MV5BODUyZjg2YzctNGE3Yi00YjhhLTkyZTItZTAwZTNhNDA1ODQzXkEyXkFqcGc@._V1_.jpg", "A father fights fiercely against ruthless kidnappers to save his abducted daughter.", "Action, Crime, Thriller", "113", "R", "martial arts action, tradesman, martial arts, kung fu action, journalist", "HK", "74", "UP 17", "Kenji Tanigaki", "Frank Hui, Zhilong Lei, Tin Shu Mak", "Miao Xie, Joe Taslim, Enyou Yang", "Miao Xie, Joe Taslim, Enyou Yang, Brian Le", "USD 20,000,000", "", "", "", "Bangkok, Thailand", "Chinese, English, Thai", "Dolby Digital", "", "Color", "1", "2", "Movie", "False", "False", "False"
"The Mandalorian and Grogu", "7", "61069", "https://www.imdb.com/title/tt30825738/", "https://m.media-amazon.com/images/M/MV5BYjRkYzAzNjktZmRhMy00NjRiLWE0OTMtYmRmMTE5NDkzY2NlXkEyXkFqcGc@._V1_.jpg", "Once a lone bounty hunter, Mandalorian Din Djarin and his apprentice Grogu embark on an exciting new Star Wars adventure.", "Action, Adventure, Family", "132", "PG-13", "star wars, space sci fi, space adventure, epic sci fi, epic fantasy", "US", "10", "DOWN 7", "Jon Favreau", "Jon Favreau, Dave Filoni, Noah Kloor", "Pedro Pascal, Brendan Wayne, Lateef Crowder", "Pedro Pascal, Brendan Wayne, Lateef Crowder, Sigourney Weaver", "", "USD 81,670,433", "USD 156,855,061", "USD 294,655,061", "Los Angeles, California, USA", "English", "Dolby Atmos, IMAX 6-Track, Auro 11.1, Dolby Surround 7.1, Dolby Digital, DTS:X, Dolby Surround 5.1", "2.39 : 1", "Color", "0", "3", "Movie", "False", "False", "False"
"Hokum", "6.8", "33496", "https://www.imdb.com/title/tt35672862/", "https://m.media-amazon.com/images/M/MV5BZjA1ZjFlZGItNTVjZC00NTFhLTg2YTEtODMzODRmNGFiNTdmXkEyXkFqcGc@._V1_.jpg", "A horror writer visits an Irish inn to scatter his parents&apos; ashes, unaware the property is said to be haunted by a witch.", "Horror, Thriller", "107", "R", "haunted hotel room, hotel, supernatural horror, psychological horror, witch horror", "IE", "11", "UP 19", "Damian McCarthy", "", "Adam Scott, Peter Coonan, David Wilmot", "Adam Scott, Peter Coonan, David Wilmot, Florence Ordesh", "", "USD 6,428,305", "USD 16,956,360", "USD 23,927,856", "Skibbereen, Co. Cork, Ireland", "English", "Dolby Atmos", "2.39 : 1", "Color", "0", "0", "Movie", "False", "False", "False"
"Bhooth Bangla", "5.5", "19823", "https://www.imdb.com/title/tt29540862/", "https://m.media-amazon.com/images/M/MV5BN2Y3NjRhYmMtNWVjMy00ZmE1LWJkNGYtNDY3Y2I3NjkzOGE0XkEyXkFqcGc@._V1_.jpg", "A man inherits a palace in rural Mangalpur and plans his sister&apos;s wedding there, but strange supernatural events and panicked locals force him to investigate the property&apos;s mysterious past.", "Comedy, Horror", "173", "", "horror comedy, haunted house", "IN", "20", "UP 1262", "Priyadarshan", "Aakash Kaushik, Abilash Nair, Priyadarshan", "Akshay Kumar, Paresh Rawal, Tabu", "Akshay Kumar, Paresh Rawal, Tabu, Mithila Palkar", "INR 1,500,000,000", "USD 950,000", "USD 2,168,456", "USD 4,912,634", "Southampton, England, UK", "Hindi", "Dolby Atmos", "2.39:1", "Color", "0", "0", "Movie", "False", "False", "False"
"Supergirl", "0", "0", "https://www.imdb.com/title/tt8814476/", "https://m.media-amazon.com/images/M/MV5BNjlhMTdmODYtOGE0ZC00YzAwLWI1NDMtMTIzZDQzZGVkNDMwXkEyXkFqcGc@._V1_.jpg", "Kara Zor-El, aka Supergirl, joins forces with an unlikely companion on an interstellar journey of vengeance and justice when an unexpected adversary strikes too close to home.", "Action, Adventure, Drama", "107", "PG-13", "supergirl character, based on comic book, animal, pet, dog", "US", "27", "UP 35", "Craig Gillespie", "Ana Nogueira, Jerry Siegel, Joe Shuster", "Milly Alcock, Eve Ridley, Matthias Schoenaerts", "Milly Alcock, Eve Ridley, Matthias Schoenaerts, Jason Momoa", "USD 175,000,000", "", "", "", "Iceland", "English", "Dolby Digital, Dolby Atmos, IMAX 6-Track", "2.39 : 1", "Color", "0", "2", "Movie", "False", "False", "False"
"Kolory zla. Czern", "5.9", "1045", "https://www.imdb.com/title/tt38681832/", "https://m.media-amazon.com/images/M/MV5BMjQ0YzU1NTktYjYzMS00ZTUyLWFlYjQtNTRiOWJiZDVkZTFmXkEyXkFqcGc@._V1_.jpg", "When a young boy goes missing in a small town, a newly reassigned prosecutor begins to uncover unexpected links to an old missing persons case.", "Crime, Drama", "110", "TV-MA", "", "PL", "22", "UP 7500", "Adrian Panek", "Adrian Panek, Malgorzata Oliwia Sobczak", "Jakub Gierszal, Marianna Zydek, Andrzej Chyra", "Jakub Gierszal, Marianna Zydek, Andrzej Chyra, Beata Scibakówna", "", "", "", "", "", "Polish", "", "2.00 : 1", "Color", "0", "0", "Movie", "False", "False", "False"
"The Social Reckoning", "0", "0", "https://www.imdb.com/title/tt37510326/", "https://m.media-amazon.com/images/M/MV5BYWM4MTEyY2MtZmIwMy00Zjk5LWIyMmQtZTkxNTI2Mjk1NDhmXkEyXkFqcGc@._V1_.jpg", "Follows Frances Haugen, a young Facebook engineer, who enlisted the help of Jeff Horwitz, a Wall Street Journal reporter, to blow the whistle on the social network&apos;s most guarded secrets.", "Biography, Drama, Thriller", "0", "", "facebook, second part, 2020s, 21st century, based on real people", "US", "23", "UP 2065", "Aaron Sorkin", "Aaron Sorkin, Jeff Horwitz", "Betty Gilpin, Jeremy Allen White, Billy Magnussen", "Betty Gilpin, Jeremy Allen White, Billy Magnussen, Mikey Madison", "", "", "", "", "San Francisco, California, USA", "English", "Dolby Digital", "", "Color", "0", "0", "Movie", "False", "False", "False"
"Remarkably Bright Creatures", "7.7", "35119", "https://www.imdb.com/title/tt33100314/", "https://m.media-amazon.com/images/M/MV5BNzM3OTRlZDktYTk0OS00OTlmLWFhMjctMTZiODU4N2RiYzhhXkEyXkFqcGc@._V1_.jpg", "Through unlikely bonds formed during night shifts at a local aquarium, Tova, an elderly widow, learns of a life-changing discovery that may bring her joy and wonder once again.", "Comedy, Drama", "111", "PG-13", "octopus, reference to slipknot, car breaks down, camper van, loss of son", "US", "16", "DOWN 8", "Olivia Newman", "Olivia Newman, John Whittington, Shelby Van Pelt", "Sally Field, Lewis Pullman, Colm Meaney", "Sally Field, Lewis Pullman, Colm Meaney, Joan Chen", "", "", "", "", "Maple Ridge, British Columbia, Canada", "English", "Dolby Digital", "1.85 : 1", "Color", "0", "2", "Movie", "False", "False", "False"
"The Amazing Digital Circus: The Last Act", "7.7", "3383", "https://www.imdb.com/title/tt41635245/", "https://m.media-amazon.com/images/M/MV5BODQ0NzQ2YTYtZDc2NS00YTlmLThjNmYtMWRkN2VkNzI4NWNhXkEyXkFqcGc@._V1_.jpg", "Feature length version of the final two episodes (episode 8 and 9) of The Amazing Digital Circus, showing the conclusion of the cast of characters trapped in a digital realm under the mercy of an unstable ringmaster.", "Animation, Adventure, Comedy", "95", "Not Rated", "psychological thriller, for grown ups animation, cg animation, indie animation, chess piece", "US", "25", "UP 27", "Gooseworx", "", "Lizzie Freeman, Michael Kovach, Amanda Hufford", "Lizzie Freeman, Michael Kovach, Amanda Hufford, Marissa Lenti", "", "USD 12,392,184", "USD 23,421,793", "USD 37,620,876", "", "English", "", "", "Color", "0", "0", "Movie", "False", "False", "False"
"Maternal Instinct", "7.4", "1777", "https://www.imdb.com/title/tt42863533/", "https://m.media-amazon.com/images/M/MV5BMjAwZThiZTctZDJjZS00YWU5LTg4NjgtMDNkOTBmYjg3NGEwXkEyXkFqcGc@._V1_.jpg", "When a Texas state trooper pulled over a woman driving erratically on the highway in 2020, she claimed she had just given birth, but her story didn&apos;t add up.", "Documentary, Crime", "94", "TV-MA", "murder, homicide, deception, fetal abduction, fake pregnancy", "US", "26", "UP 4783", "Jessica Dimmock", "", "Jessica Brookes, Wade Griffin, Taylor Parker", "Jessica Brookes, Wade Griffin, Taylor Parker, Reagan Simmons-Hancock", "", "", "", "", "", "English", "", "", "Color", "0", "0", "Movie", "False", "False", "False"
"Apex", "6.1", "88757", "https://www.imdb.com/title/tt16431404/", "https://m.media-amazon.com/images/M/MV5BNjUzODE2ZWYtMDdiMS00ZTA0LWI4MzEtNDkyODNiNmIwMWY1XkEyXkFqcGc@._V1_.jpg", "A mountain climber haunted by a fatal decision in Norway retreats to the Australian wilderness for isolation. Her journey turns into a desperate hunt when a deceptive local targets her as his next ritualistic prey in the bush.", "Action, Thriller", "95", "R", "serial killer, river, survival adventure, climbing, australia", "US", "17", "DOWN 6", "Baltasar Kormákur", "", "Charlize Theron, Taron Egerton, Eric Bana", "Charlize Theron, Taron Egerton, Eric Bana, Matt Whelan", "", "", "", "", "Blue Mountains, New South Wales, Australia", "English", "Dolby Atmos", "2.20 : 1", "Color", "0", "1", "Movie", "False", "False", "False"
"Ladies First", "5.8", "24873", "https://www.imdb.com/title/tt34611082/", "https://m.media-amazon.com/images/M/MV5BNjBhMjk2NmQtY2JhOC00OTIzLTkzZjItNjA2NWM3OTkzNzA5XkEyXkFqcGc@._V1_.jpg", "A male chauvinist is transported to a matriarchal society, facing challenges from a formidable female version of himself.", "Comedy", "90", "R", "film adaptation, north american adaptation of french source material, american adaptation of french source material, american adaptation of european source material, adaptation", "US", "14", "DOWN 9", "Thea Sharrock", "Natalie Krinsky, Cinco Paul, Katie Silberman", "Sacha Baron Cohen, Rosamund Pike, Tom Davis", "Sacha Baron Cohen, Rosamund Pike, Tom Davis, Emily Mortimer", "", "", "", "", "", "English", "Dolby Atmos", "2.39 : 1", "Color", "0", "0", "Movie", "False", "False", "False"
"The Sheep Detectives", "7.6", "19542", "https://www.imdb.com/title/tt32565993/", "https://m.media-amazon.com/images/M/MV5BNTFmZWI4YmMtNmQ0ZC00ZGQwLTk1OWEtZjAyZmIzOGY0MGFiXkEyXkFqcGc@._V1_.jpg", "Every night a shepherd reads aloud a murder mystery, pretending his sheep can understand. When he is found dead, the sheep realize at once that it was a murder and think they know everything about how to go about solving it.", "Comedy, Family, Mystery", "109", "PG", "whodunnit mystery, whodunit, animals family, sheep, shepherd", "IE", "18", "DOWN 9", "Kyle Balda", "Craig Mazin, Leonie Swann", "Hugh Jackman, Brett Goldstein, Patrick Stewart", "Hugh Jackman, Brett Goldstein, Patrick Stewart, Regina Hall", "USD 75,000,000", "USD 15,087,796", "USD 59,790,243", "USD 115,090,243", "Shepperton Studios, Surrey, England, UK", "English", "Dolby Digital, Dolby Atmos", "2.00 : 1", "Color", "1", "0", "Movie", "False", "False", "False"
"Dhurandhar: The Revenge", "8.3", "60581", "https://www.imdb.com/title/tt39139925/", "https://m.media-amazon.com/images/M/MV5BNzdkNjAxNWMtNWY3My00NTI1LTg2YWQtOGI3MDA0NzdhMjEyXkEyXkFqcGc@._V1_.jpg", "Jaskirat Singh Rangi descends deeper into his alias as Hamza Ali Mazari, rising through Karachi&apos;s criminal hierarchy to claim the feared title &quot;Sher-e-Baloch&quot; while balancing loyalty, betrayal, and survival in a ruthless underworld.", "Action, Crime, Thriller", "235", "TV-MA", "spy action, spy thriller, secret identity, gangster crime, gangwar", "IN", "42", "DOWN 25", "Aditya Dhar", "", "Ranveer Singh, Akshaye Khanna, Sanjay Dutt", "Ranveer Singh, Akshaye Khanna, Sanjay Dutt, Arjun Rampal", "", "USD 10,037,581", "USD 28,100,759", "USD 152,900,759", "", "Hindi", "IMAX 6-Track, Dolby Atmos, 12-Track Digital Sound", "2.39 : 1", "Color", "0", "0", "Movie", "False", "False", "False"
