"Iron Lung", "5.9", "27976", "https://www.imdb.com/title/tt27564844/", "https://m.media-amazon.com/images/M/MV5BYzkxOGU1YmQtNDc0Ni00M2JhLWFlZjktODMzOGU3MjQxMTQ0XkEyXkFqcGc@._V1_.jpg", "In a post-apocalyptic future after &quot;The Quiet Rapture&quot; event, a convict explores a blood ocean on a desolate moon using a submarine called the &quot;Iron Lung&quot; to search for missing stars/planets.", "Horror, Sci-Fi", "125", "R", "post apocalypse, based on video game, space sci fi, psychological horror, body horror", "US", "90", "DOWN 43", "Mark Fischbach", "Mark Fischbach, David Szymanski", "Mark Fischbach, Caroline Kaplan, Troy Baker", "Mark Fischbach, Caroline Kaplan, Troy Baker, Elsie Lovelock", "USD 3,000,000", "USD 17,800,000", "USD 40,851,941", "USD 50,036,487", "Austin, Texas, USA", "English", "Dolby Digital", "1.85 : 1", "Color", "0", "2", "Movie", "False", "False", "False"
"Normal", "6.3", "15868", "https://www.imdb.com/title/tt31195136/", "https://m.media-amazon.com/images/M/MV5BOGIyZjgwMzMtODEzZS00YmFlLTg3NmItOWMwYzhlZDBjY2U3XkEyXkFqcGc@._V1_.jpg", "Centers on a temporary small-town sheriff who uncovers dark mysteries after a local bank robbery.", "Action, Crime, Thriller", "91", "R", "small town, sheriff, snowstorm, suicidal, asian", "CA", "91", "UP 15", "Ben Wheatley", "Derek Kolstad, Bob Odenkirk", "Bob Odenkirk, Ryan Allen, Billy MacLellan", "Bob Odenkirk, Ryan Allen, Billy MacLellan, Lena Headey", "USD 17,000,000", "USD 2,550,311", "USD 5,071,290", "USD 5,978,949", "Winnipeg, Manitoba, Canada", "English, Japanese", "", "2.39 : 1", "Color", "0", "1", "Movie", "False", "False", "False"
"Crime 101", "6.8", "83202", "https://www.imdb.com/title/tt32430579/", "https://m.media-amazon.com/images/M/MV5BZThlN2M4ZTUtYTU3Mi00MDE5LWFhYWUtNjkxMWEwNjUwNDVhXkEyXkFqcGc@._V1_.jpg", "A meticulous jewel thief risks his flawless record against an equally obsessive detective and a volatile rival, while an underestimated insurance broker turns accomplice after decades of professional disrespect.", "Crime, Drama, Thriller", "140", "R", "los angeles california, diamond, heist, male underwear, downtown los angeles", "US", "92", "DOWN 6", "Bart Layton", "Bart Layton, Don Winslow", "Chris Hemsworth, Mark Ruffalo, Barry Keoghan", "Chris Hemsworth, Mark Ruffalo, Barry Keoghan, Peter Banifaz", "USD 90,000,000", "USD 14,251,834", "USD 36,588,336", "USD 72,900,246", "Echo Park, Los Angeles, California, USA", "English", "DTS:X, Dolby Surround 5.1, Dolby Digital, SDDS, Dolby Atmos", "2.39 : 1", "Color", "0", "0", "Movie", "False", "False", "False"
"Inception", "8.8", "2828016", "https://www.imdb.com/title/tt1375666/", "https://m.media-amazon.com/images/M/MV5BMjAxMzY3NjcxNF5BMl5BanBnXkFtZTcwNTI5OTM0Mw@@._V1_.jpg", "A thief who steals corporate secrets through the use of dream-sharing technology is given the inverse task of planting an idea into the mind of a CEO, but his tragic past may doom the project and his team to disaster.", "Adventure, Sci-Fi, Thriller", "148", "PG-13", "dream, ambiguous ending, subconscious, surprise ending, mindbender", "GB", "93", "UP 6", "Christopher Nolan", "", "Leonardo DiCaprio, Joseph Gordon-Levitt, Elliot Page", "Leonardo DiCaprio, Joseph Gordon-Levitt, Elliot Page, Tom Hardy", "USD 160,000,000", "USD 62,785,337", "USD 292,587,330", "USD 839,797,462", "Fortress Mountain, Kananaskis Country, Alberta, Canada", "English, Japanese, French", "Dolby Digital, DTS, SDDS", "2.39 : 1", "Color", "160", "220", "Movie", "False", "False", "False"
"Top Gun: Maverick", "8.2", "883594", "https://www.imdb.com/title/tt1745960/", "https://m.media-amazon.com/images/M/MV5BMDBkZDNjMWEtOTdmMi00NmExLTg5MmMtNTFlYTJlNWY5YTdmXkEyXkFqcGc@._V1_.jpg", "The story involves Maverick confronting his past while training a group of younger Top Gun graduates, including the son of his deceased best friend, for a dangerous mission.", "Action, Drama", "130", "PG-13", "fighter jet, aircraft carrier, dogfight, military propaganda, sequel", "US", "94", "UP 10", "Joseph Kosinski", "Ehren Kruger, Eric Warren Singer, Christopher McQuarrie", "Tom Cruise, Jennifer Connelly, Miles Teller", "Tom Cruise, Jennifer Connelly, Miles Teller, Val Kilmer", "USD 177,000,000", "USD 126,707,459", "USD 721,996,984", "USD 1,503,260,455", "Eldorado National Forest, California, USA", "English", "Dolby Atmos, Auro 11.1, IMAX 6-Track, 12-Track Digital Sound, Sonics-DDP", "2.39 : 1", "Color", "114", "237", "Movie", "False", "False", "False"
"The Lord of the Rings: The Fellowship of the Ring", "8.9", "2213203", "https://www.imdb.com/title/tt0120737/", "https://m.media-amazon.com/images/M/MV5BNzIxMDQ2YTctNDY4MC00ZTRhLTk4ODQtMTVlOWY4NTdiYmMwXkEyXkFqcGc@._V1_.jpg", "A meek Hobbit from the Shire and eight companions set out on a journey to destroy the powerful One Ring and save Middle-earth from the Dark Lord Sauron.", "Adventure, Drama, Fantasy", "178", "PG-13", "ring, quest, middle earth, elf, based on novel", "NZ", "95", "UP 7", "Peter Jackson", "J.R.R. Tolkien, Fran Walsh, Philippa Boyens", "Elijah Wood, Ian McKellen, Orlando Bloom", "Elijah Wood, Ian McKellen, Orlando Bloom, Alan Howard", "USD 93,000,000", "USD 47,211,490", "USD 325,873,309", "USD 897,519,866", "Wellington, New Zealand", "English, Sindarin", "DTS, SDDS", "2.39 : 1", "Color", "126", "127", "Movie", "False", "False", "False"
"Street Kings", "6.8", "128181", "https://www.imdb.com/title/tt0421073/", "https://m.media-amazon.com/images/M/MV5BYjFiYzYyYWYtNTE2Mi00M2QyLWE3ODYtNDBiZGZiMDY0ZTdkXkEyXkFqcGc@._V1_.jpg", "An undercover cop, disillusioned by the death of his wife, is implicated in the murder of an officer and must struggle to clear himself.", "Action, Crime, Thriller", "109", "R", "violence, death, undercover cop, gun salute, police funeral", "US", "96", "UP 1403", "David Ayer", "James Ellroy, Kurt Wimmer, Jamie Moss", "Keanu Reeves, Forest Whitaker, Hugh Laurie", "Keanu Reeves, Forest Whitaker, Hugh Laurie, Chris Evans", "USD 20,000,000", "USD 12,469,631", "USD 26,418,667", "USD 66,476,363", "Habachihana Grill - 1045 S. Hill Street, Los Angeles, California, USA", "English, Turkish", "DTS, Dolby Digital, SDDS", "2.35 : 1", "", "0", "1", "Movie", "False", "False", "False"
"Goat", "6.7", "25914", "https://www.imdb.com/title/tt27613895/", "https://m.media-amazon.com/images/M/MV5BYzE5OTJkOGMtYWFiNi00NTlkLWE3ZWItY2ZlNjkyOWVhMjMyXkEyXkFqcGc@._V1_.jpg", "A small goat with big dreams gets a once-in-a-lifetime shot to join the pros and play roarball, a high-intensity, co-ed, full-contact sport dominated by the fastest, fiercest animals in the world.", "Animation, Adventure, Comedy", "100", "PG", "3d, cg animation, animal in title, computer animation, cgi animation", "US", "97", "DOWN 13", "", "Aaron Buchsbaum, Teddy Riley, Nicolas Curcio", "Caleb McLaughlin, Gabrielle Union, Stephen Curry", "Caleb McLaughlin, Gabrielle Union, Stephen Curry, Aaron Pierre", "", "USD 27,202,138", "USD 103,316,898", "USD 194,948,748", "", "English, Italian", "Dolby Digital, Dolby Surround 5.1, Dolby Atmos, IMAX 6-Track, DTS:X", "2.39 : 1", "Color", "0", "0", "Movie", "False", "False", "False"
"Stop! That! Train!", "6.4", "1275", "https://www.imdb.com/title/tt38128726/", "https://m.media-amazon.com/images/M/MV5BYmM2MmJkMDEtYjc2Yi00NGMzLWExYjAtMjQzN2RiNzkwZWE3XkEyXkFqcGc@._V1_.jpg", "Two train stewardess BFFs switch from a dull railway to the luxurious Glamazonian Express. During a massive storm, they must work with snooty first-class crew and President Gagwell to prevent disaster in LA.", "Action, Comedy", "90", "R", "rupauls drag race, gay interest, gay", "US", "98", "DOWN 54", "Adam Shankman", "Christina Friel, Connor Wright", "Brock Hayhoe, Paul Scheer, Symone", "Brock Hayhoe, Paul Scheer, Symone, Joel McHale", "", "USD 2,024,840", "USD 3,256,717", "USD 3,256,717", "Los Angeles, California, USA", "English", "", "", "Color", "0", "1", "Movie", "False", "False", "False"
"The Running Man", "6.4", "112347", "https://www.imdb.com/title/tt14107334/", "https://m.media-amazon.com/images/M/MV5BMTk5NjU4OTAtNTEyMS00ZjBiLTg0ZjMtOGJiMGJhNjQ3MzYxXkEyXkFqcGc@._V1_.jpg", "A man joins a game show in which contestants, allowed to flee anywhere in the world, are pursued by &quot;hunters&quot; hired to kill them.", "Action, Adventure, Sci-Fi", "133", "R", "dystopia, dystopian sci fi, fictional game show, survival, fictional reality tv show", "GB", "99", "DOWN 1", "Edgar Wright", "Stephen King, Michael Bacall, Edgar Wright", "Glen Powell, Alyssa Benn, Sienna Benn", "Glen Powell, Alyssa Benn, Sienna Benn, David Zayas", "USD 110,000,000", "USD 16,495,564", "USD 37,815,641", "USD 69,486,523", "Bulgaria", "English", "Dolby Atmos, Dolby Digital, DTS:X, 12-Track Digital Sound, IMAX 6-Track", "2.39 : 1", "Color", "0", "10", "Movie", "False", "False", "False"
"Midsommar", "7.1", "488245", "https://www.imdb.com/title/tt8772262/", "https://m.media-amazon.com/images/M/MV5BMzQxNzQzOTQwM15BMl5BanBnXkFtZTgwMDQ2NTcwODM@._V1_.jpg", "A couple travels to Northern Europe to visit a rural hometown&apos;s fabled Swedish mid-summer festival. What begins as an idyllic retreat quickly devolves into an increasingly violent and bizarre competition at the hands of a pagan cult.", "Drama, Horror, Mystery", "148", "R", "religious cult, cult, summer festival, grief, burned alive", "US", "100", "UP 94", "Ari Aster", "", "Florence Pugh, Jack Reynor, Vilhelm Blomgren", "Florence Pugh, Jack Reynor, Vilhelm Blomgren, William Jackson Harper", "USD 9,000,000", "USD 6,560,030", "USD 27,426,361", "USD 48,545,238", "Budapest, Hungary", "English, Swedish", "Dolby Digital", "2.00 : 1", "Color", "27", "74", "Movie", "False", "False", "False"
