"Marshals", "6.1", "15165", "https://www.imdb.com/title/tt36849871/", "https://m.media-amazon.com/images/M/MV5BOTk4NThjNzgtMjVjNi00MjdjLWE1NDctMzRhNTI1Y2RiN2NkXkEyXkFqcGc@._V1_.jpg", "Ex-Navy SEAL Kayce Dutton leaves the Yellowstone ranch to work with an elite U.S. Marshals team.", "Action, Crime, Drama", "0", "TV-14", "yellowstone franchise, police investigation, united states of america, law enforcement, widower", "US", "68", "DOWN 13", "", "", "Luke Grimes, Ash Santos, Tatanka Means", "Luke Grimes, Ash Santos, Tatanka Means, Logan Marshall-Green", "", "", "", "", "Park city, Utah, USA", "English", "Stereo", "16:9 HD", "Color", "0", "0", "TV Series", "True", "False", "False"
"True Detective", "8.8", "759220", "https://www.imdb.com/title/tt2356777/", "https://m.media-amazon.com/images/M/MV5BYjgwYzA1NWMtNDYyZi00ZGQyLWI5NTktMDYwZjE2OTIwZWEwXkEyXkFqcGc@._V1_.jpg", "Anthology series in which police investigations unearth the personal and professional secrets of those involved, both within and outside the law.", "Crime, Drama, Mystery", "0", "TV-MA", "murder, police investigation, police detective, southern gothic, louisiana", "US", "69", "UP 7", "", "", "Vince Vaughn, Colin Farrell, Rachel McAdams", "Vince Vaughn, Colin Farrell, Rachel McAdams, Matthew McConaughey", "", "", "", "", "Arkansas, USA", "English", "Dolby Digital", "1.78 : 1", "Color", "48", "171", "TV Series", "True", "False", "False"
"Paradise", "7.9", "83325", "https://www.imdb.com/title/tt27444205/", "https://m.media-amazon.com/images/M/MV5BYTNmMjEwZGYtZWJjNy00MjI2LWI3YmUtNTY3NjVkMmU4MDM0XkEyXkFqcGc@._V1_.jpg", "A Secret Service agent investigates the murder of a former president in a seemingly peaceful community.", "Action, Drama, Mystery", "0", "TV-MA", "conspiracy thriller, dystopian sci fi, male star appears nude, male rear nudity, male nudity", "US", "70", "UP 2", "", "", "Sterling K. Brown, Sarah Shahi, Nicole Brydon Bloom", "Sterling K. Brown, Sarah Shahi, Nicole Brydon Bloom, Julianne Nicholson", "", "", "", "", "Warner Brothers Burbank Studios - 4000 Warner Boulevard, Burbank, California, USA", "English", "Dolby Digital", "2.39 : 1", "Color", "11", "34", "TV Series", "True", "False", "False"
"Love Island USA", "5.2", "3781", "https://www.imdb.com/title/tt8819906/", "https://m.media-amazon.com/images/M/MV5BZTE0ODRhMDctZWE5NC00ZTk5LThlNmQtYmY3MTZjMjhhNDA3XkEyXkFqcGc@._V1_.jpg", "U.S. version of the British show &apos;Love Island&apos; where a group of singles come to stay in a villa for a few weeks and have to couple up with one another.", "Game-Show, Reality-TV, Romance", "0", "TV-MA", "dating and romance reality tv, dating game show, love in title, love island, non fiction", "US", "71", "UP 3", "", "", "Iain Stirling, Matthew Hoffman, Ariana Madix", "Iain Stirling, Matthew Hoffman, Ariana Madix, Cely Vazquez", "", "", "", "", "Mamanuca Islands, Fiji", "English", "", "", "Color", "2", "2", "TV Series", "True", "False", "False"
"Beef", "8", "175211", "https://www.imdb.com/title/tt14403178/", "https://m.media-amazon.com/images/M/MV5BMGNlNDkyYzItNTg5Yy00NGFiLWJhYTctODE5NjNkYjk4ZDUwXkEyXkFqcGc@._V1_.jpg", "Minor conflicts spiral into consuming feuds between individuals, exposing pride, resentment, and hidden pain.", "Comedy, Drama", "0", "TV-MA", "lesbian character, lesbian relationship, dramedy, asian american, revenge", "US", "72", "DOWN 6", "", "", "Steven Yeun, Ali Wong, Joseph Lee", "Steven Yeun, Ali Wong, Joseph Lee, Young Mazino", "", "", "", "", "22830 Paul Revere Drive, Calabasas, California, USA", "English", "Dolby Digital", "2.00 : 1", "Color", "44", "50", "TV Series", "True", "False", "False"
"The Handmaid&apos;s Tale", "8.3", "300665", "https://www.imdb.com/title/tt5834204/", "https://m.media-amazon.com/images/M/MV5BMWIxMzk4NmItZmM1YS00ODUyLWFlNjgtZDQ4MzljZTZmZDQ5XkEyXkFqcGc@._V1_.jpg", "Set in a dystopian future, a woman is forced to live as a concubine under a fundamentalist theocratic dictatorship.", "Drama, Sci-Fi, Thriller", "0", "TV-MA", "rape, dystopia, slavery, torture, violence", "US", "73", "DOWN 15", "", "", "Elisabeth Moss, Yvonne Strahovski, Ann Dowd", "Elisabeth Moss, Yvonne Strahovski, Ann Dowd, Madeline Brewer", "", "", "", "", "Cambridge, Ontario, Canada", "English, German", "Dolby Digital", "2.00 : 1", "Color", "97", "299", "TV Series", "True", "False", "False"
"Shrinking", "8.2", "125985", "https://www.imdb.com/title/tt15677150/", "https://m.media-amazon.com/images/M/MV5BYmU3Yjg0Y2UtN2E5Yy00NzYyLThlNzQtOTI2YWE2OWJhYTUyXkEyXkFqcGc@._V1_.jpg", "A grieving therapist starts to tell his clients exactly what he thinks. Ignoring his training and ethics, he finds himself making huge changes to people&apos;s lives - including his own.", "Comedy, Drama", "0", "TV-MA", "therapy, therapist patient relationship, patient, therapist, parkison disease", "US", "74", "DOWN 3", "", "", "Jason Segel, Jessica Williams, Harrison Ford", "Jason Segel, Jessica Williams, Harrison Ford, Luke Tennie", "", "", "", "", "Central Park, 275 S Raymond Ave, Pasadena, California, USA", "English", "Stereo", "2.00 : 1", "Color", "12", "65", "TV Series", "True", "False", "False"
"Reacher", "8", "296129", "https://www.imdb.com/title/tt9288030/", "https://m.media-amazon.com/images/M/MV5BMzdjYWZlMDQtYzdhNi00NmRlLTg2NzUtMTI3MWFhZDliNjBiXkEyXkFqcGc@._V1_.jpg", "Itinerant former military policeman Jack Reacher solves crimes and metes out his own brand of street justice. Based on the novels by Lee Child.", "Action, Crime, Drama", "0", "TV-MA", "vigilantism, hobo, based on novel, vigilante justice, vigilante", "US", "75", "UP 9", "", "", "Alan Ritchson, Maria Sten, Malcolm Goodwin", "Alan Ritchson, Maria Sten, Malcolm Goodwin, Willa Fitzgerald", "", "", "", "", "Kingston Penitentiary, Kingston, Ontario, Canada", "English", "Dolby Atmos", "2.00 : 1", "Color", "3", "13", "TV Series", "True", "False", "False"
"Dexter", "8.6", "940667", "https://www.imdb.com/title/tt0773262/", "https://m.media-amazon.com/images/M/MV5BNTE5ZGI2N2UtYmFiMi00ZGIxLWI1ZTMtYWJkZDYxNDZiOTQwXkEyXkFqcGc@._V1_.jpg", "He&apos;s smart. He&apos;s lovable. He&apos;s Dexter Morgan, America&apos;s favorite serial killer, who spends his days solving crimes and his nights committing them.", "Crime, Drama, Mystery", "0", "TV-MA", "double life, police department, dark secret, homicide, serial murder", "US", "76", "UP 10", "", "", "Michael C. Hall, Jennifer Carpenter, David Zayas", "Michael C. Hall, Jennifer Carpenter, David Zayas, James Remar", "", "", "", "", "1155 103rd St, Bay Harbor Islands, Florida, USA", "English, Spanish", "Dolby Digital", "16:9 HD", "Color", "56", "202", "TV Series", "True", "False", "False"
"The Big Bang Theory", "8.1", "939261", "https://www.imdb.com/title/tt0898266/", "https://m.media-amazon.com/images/M/MV5BZjgzY2QyNzItNDhhYi00ZWIwLWFjN2UtZDJkN2MxYWNjMmJjXkEyXkFqcGc@._V1_.jpg", "The lives of four socially awkward scientists take a wild turn when a beautiful and free-spirited girl moves in next door.", "Comedy, Romance", "0", "TV-PG", "friend, roommate, best friend, comic book shop, friendship", "US", "77", "UP 4", "", "", "Johnny Galecki, Jim Parsons, Kaley Cuoco", "Johnny Galecki, Jim Parsons, Kaley Cuoco, Simon Helberg", "", "", "", "", "Stage 25, Warner Brothers Burbank Studios - 4000 Warner Boulevard, Burbank, California, USA", "English, Hindi, Italian, Russian, Mandarin, Klingon", "Stereo, Dolby Digital", "16:9 HD", "Color", "79", "257", "TV Series", "True", "False", "False"
"The Madison", "7.8", "20579", "https://www.imdb.com/title/tt33204276/", "https://m.media-amazon.com/images/M/MV5BZGFiODdjY2UtNzAxZC00Mjc3LWJiZTQtYzQ2ZTM3ZWMzNjk0XkEyXkFqcGc@._V1_.jpg", "A New York family&apos;s life unravels after a tragedy; they process their grief while vacationing in rural Montana, where they explore human connection amid their profound sorrow.", "Drama", "0", "TV-MA", "yellowstone franchise, montana, ranch, legacy, family dynasty", "US", "78", "DOWN 8", "", "", "Michelle Pfeiffer, Kurt Russell, Beau Garrett", "Michelle Pfeiffer, Kurt Russell, Beau Garrett, Patrick J. Adams", "", "", "", "", "Bozeman, Montana, USA", "English", "Dolby Surround 5.1", "2.39 : 1", "Color", "0", "0", "TV Series", "True", "False", "False"
"NCIS", "7.8", "177054", "https://www.imdb.com/title/tt0364845/", "https://m.media-amazon.com/images/M/MV5BZGExNmI3NDMtMjYxYS00Y2ZmLTlkNmItMGNkNTQ1MzA1ZGM1XkEyXkFqcGc@._V1_.jpg", "Naval Criminal Investigative Service agents investigate criminal cases connected to Navy and Marine Corps personnel.", "Action, Crime, Drama", "0", "TV-14", "goth girl, police propaganda, special agent, naval criminal investigative service, police procedural", "US", "79", "UP 3", "", "", "Sean Murray, David McCallum, Mark Harmon", "Sean Murray, David McCallum, Mark Harmon, Brian Dietzen", "", "", "", "", "Valencia Studios - 26030 Avenue Hall, Valencia, California, USA", "English", "Dolby Digital", "1.78 : 1, 16:9 HD", "Color", "27", "45", "TV Series", "True", "False", "False"
"The Testaments", "8.3", "10800", "https://www.imdb.com/title/tt10970762/", "https://m.media-amazon.com/images/M/MV5BMjZhODhiYmEtNTg0ZS00Mjc0LTk0NTYtMGEwMGFlNjFkZGM0XkEyXkFqcGc@._V1_.jpg", "This sequel to &quot;The Handmaid&apos;s Tale&quot; follows Agnes and Daisy, two teens in Gilead who must navigate an elite preparatory school where obedience is brutally enforced. Their bond becomes the catalyst that will transform their lives.", "Drama, Thriller", "0", "TV-MA", "sequel to tv series, dystopia, epic, the future, adult fiction", "US", "80", "DOWN 20", "", "", "Chase Infiniti, Lucy Halliday, Mabel Li", "Chase Infiniti, Lucy Halliday, Mabel Li, Brad Alexander", "", "", "", "", "Toronto, Ontario, Canada", "English", "Dolby Digital", "2.00 : 1", "Color", "1", "0", "TV Series", "True", "False", "False"
"Half Man", "8", "12524", "https://www.imdb.com/title/tt32767294/", "https://m.media-amazon.com/images/M/MV5BMmM3ZDgwNmItYTc4Mi00MTk4LWEwMWMtNjliZGQ4NTlkZGMzXkEyXkFqcGc@._V1_.jpg", "Ruben turns up at his estranged brother Niall&apos;s wedding, acting as a catalyst for a revival of the last 40 years of their relationship.", "Drama", "0", "TV-MA", "brother brother relationship, family relationships, female topless nudity, tv mini series, gay", "GB", "81", "DOWN 25", "", "", "Jamie Bell, Richard Gadd, Neve McIntosh", "Jamie Bell, Richard Gadd, Neve McIntosh, Charlie de Melo", "", "", "", "", "Guido's Coronation Restaurant, 55 Gallowgate, Glasgow, Scotland, UK", "English", "", "", "Color", "0", "3", "TV Mini Series", "True", "False", "False"
"Black Mirror", "8.7", "740789", "https://www.imdb.com/title/tt2085059/", "https://m.media-amazon.com/images/M/MV5BODcxMWI2NDMtYTc3NC00OTZjLWFmNmUtM2NmY2I1ODkxYzczXkEyXkFqcGc@._V1_.jpg", "Featuring stand-alone dramas -- sharp, suspenseful, satirical tales that explore techno-paranoia -- &quot;Black Mirror&quot; is a contemporary reworking of &quot;The Twilight Zone&quot; with stories that tap into the collective unease about the moder...", "Crime, Drama, Mystery", "0", "TV-MA", "anthology, dystopia, technology, dystopian future, news satire", "GB", "82", "UP 3", "", "", "Anjana Vasan, Cristin Milioti, Jesse Plemons", "Anjana Vasan, Cristin Milioti, Jesse Plemons, Aaron Paul", "", "", "", "USD 320,000", "Toronto, Ontario, Canada", "English", "Stereo, Dolby Digital", "1.33 : 1", "Color", "48", "187", "TV Series", "True", "False", "False"
"Outer Banks", "7.5", "108206", "https://www.imdb.com/title/tt10293938/", "https://m.media-amazon.com/images/M/MV5BNzhkZGY0YmEtMGM0Yy00NTcyLWJiNWMtN2ZmZDRhNjdlZWE2XkEyXkFqcGc@._V1_.jpg", "On an island of haves and have-nots, teen John B enlists his three best friends to hunt for a legendary treasure linked to his father&apos;s disappearance.", "Action, Adventure, Crime", "0", "TV-MA", "treasure map, treasure hunt, coming of age, young, group", "US", "83", "UP 279", "", "", "Chase Stokes, Madelyn Cline, Madison Bailey", "Chase Stokes, Madelyn Cline, Madison Bailey, J.D.", "", "", "", "", "Charleston, South Carolina, USA", "English", "Stereo, Dolby Digital", "16:9 HD", "Color", "5", "11", "TV Series", "True", "False", "False"
"Lost", "8.3", "675091", "https://www.imdb.com/title/tt0411008/", "https://m.media-amazon.com/images/M/MV5BZmZhY2ViYzYtMTQ0NS00NDcyLWIxZTYtMGUyODE0NDA0NmNkXkEyXkFqcGc@._V1_.jpg", "The survivors of a plane crash are forced to work together in order to survive on a seemingly deserted tropical island.", "Adventure, Drama, Fantasy", "0", "TV-14", "survival, destiny, flashback, south pacific, time travel", "US", "84", "UP 7", "", "", "Naveen Andrews, Matthew Fox, Jorge Garcia", "Naveen Andrews, Matthew Fox, Jorge Garcia, Josh Holloway", "", "", "", "", "Waimea Bay, Waimea Bay Beach Park, O'ahu, Hawaii, USA", "English, Portuguese, Spanish, Arabic, French, Korean, German, Latin, Russian, Japanese", "Dolby Digital", "1.78 : 1", "Color", "119", "418", "TV Series", "True", "False", "False"
"The Agency", "7.4", "29698", "https://www.imdb.com/title/tt26656917/", "https://m.media-amazon.com/images/M/MV5BMWYzNDM4MDEtY2Y2My00MDE3LWIyMzktMTAwZTQ5YWFhZjk2XkEyXkFqcGc@._V1_.jpg", "A covert CIA agent is ordered to abandon his undercover life and return to his Station; when the love he left behind reappears, romance reignites.", "Drama, Thriller", "0", "TV-MA", "remake, agent, political drama, political thriller, spy", "FR", "85", "UP 111", "", "", "Michael Fassbender, Jeffrey Wright, Katherine Waterston", "Michael Fassbender, Jeffrey Wright, Katherine Waterston, Harriet Sansom Harris", "", "", "", "", "Tallinn, Estonia", "English", "Dolby Digital", "2.39 : 1", "Color", "0", "1", "TV Series", "True", "False", "False"
"Among Us", "7.2", "2488", "https://www.imdb.com/title/tt28230655/", "https://m.media-amazon.com/images/M/MV5BNTdhZjMyOGItZTVlZS00NTEzLTlkYmYtMDM2MDgwNTYwZDNiXkEyXkFqcGc@._V1_.jpg", "Eccentric, monochromatic crewmates of a ship transporting junk across the galaxy must root out an impostor in their midst before they fall victim to its villainous designs.", "Animation, Adventure, Comedy", "0", "TV-14", "based on video game, 2d animation, murder mystery, crew, impostor", "US", "86", "DOWN 60", "", "", "Ashley Johnson, Randall Park, Elijah Wood", "Ashley Johnson, Randall Park, Elijah Wood, Liv Hewson", "", "", "", "", "", "English", "Dolby Digital", "1.78 : 1", "Color", "0", "0", "TV Series", "True", "False", "False"
"Alice and Steve", "6.9", "1742", "https://www.imdb.com/title/tt35728748/", "https://m.media-amazon.com/images/M/MV5BYTgwODM2ZmMtYWQ1YS00NDQ2LWJlNWYtY2U3OWM0N2VjNzhiXkEyXkFqcGc@._V1_.jpg", "The 25-year-long friendship between Alice and Steve becomes strained when Steve starts dating Alice&apos;s daughter.", "Comedy, Drama, Romance", "0", "TV-MA", "", "GB", "87", "DOWN 60", "", "", "Nicola Walker, Jemaine Clement, Joel Fry", "Nicola Walker, Jemaine Clement, Joel Fry, Yali Topol Margalith", "", "", "", "", "London, England, UK", "English", "", "", "Color", "0", "0", "TV Series", "True", "False", "False"
"Pluribus", "7.9", "159706", "https://www.imdb.com/title/tt22202452/", "https://m.media-amazon.com/images/M/MV5BOWNlM2E1MDMtYmI5MS00NDQ1LWI3NTctM2VlNjQ5OTAxYTNmXkEyXkFqcGc@._V1_.jpg", "In a world overtaken by a mysterious wave of forced happiness, Carol Sturka, one of the immune few, must uncover what&apos;s really going on - and save humanity from its artificial bliss.", "Drama, Sci-Fi", "0", "TV-MA", "female protagonist, lesbian character, apple tv, dark comedy, psychological drama", "US", "88", "UP 11", "", "", "Rhea Seehorn, Karolina Wydra, Carlos-Manuel Vesga", "Rhea Seehorn, Karolina Wydra, Carlos-Manuel Vesga, Miriam Shor", "", "", "", "", "Albuquerque, New Mexico, USA", "English", "Dolby Digital, Dolby Atmos", "2.39 : 1", "Color", "12", "29", "TV Series", "True", "False", "False"
"Smallville", "7.5", "154451", "https://www.imdb.com/title/tt0279600/", "https://m.media-amazon.com/images/M/MV5BZDU0ZDVjOTItMDNkMy00YTI0LWFjYzItY2M1NjU5NjAzZGViXkEyXkFqcGc@._V1_.jpg", "A young Clark Kent struggles to find his place in the world as he learns to harness his alien powers for good and deals with the typical troubles of teenage life in Smallville, Kansas.", "Action, Adventure, Drama", "0", "TV-PG", "adoption, adopted son, meteor shower, best friend, alien", "US", "89", "UP 3", "", "", "Tom Welling, Michael Rosenbaum, Allison Mack", "Tom Welling, Michael Rosenbaum, Allison Mack, Kristin Kreuk", "", "", "", "", "Hatley Castle, Royal Roads, Colwood, British Columbia, Canada", "English", "Stereo", "1.33 : 1, 1.78 : 1", "Color", "35", "155", "TV Series", "True", "False", "False"
"Succession", "8.8", "359551", "https://www.imdb.com/title/tt7660850/", "https://m.media-amazon.com/images/M/MV5BYTY4YTVkY2QtMjRmOS00YzliLWIxOWQtMTdkOTVkN2UzODNmXkEyXkFqcGc@._V1_.jpg", "The Roy family is known for controlling the biggest media and entertainment company in the world. However, their world changes when their father steps down from the company.", "Comedy, Drama", "0", "TV-MA", "business, media empire, wealth, dysfunctional family, betrayal", "US", "90", "UP 3", "", "", "Nicholas Braun, Brian Cox, Kieran Culkin", "Nicholas Braun, Brian Cox, Kieran Culkin, Peter Friedman", "", "", "", "", "Dundee, Scotland, UK", "English", "Dolby Surround 7.1", "1.78 : 1", "Color", "142", "265", "TV Series", "True", "False", "False"
"Mad Men", "8.7", "291268", "https://www.imdb.com/title/tt0804503/", "https://m.media-amazon.com/images/M/MV5BYTNjNjc5OWQtYjMxNC00MzEwLWIxM2UtNjU3NzhkNjZmNGI3XkEyXkFqcGc@._V1_.jpg", "A drama about one of New York&apos;s most prestigious ad agencies at the beginning of the 1960s, focusing on one of the firm&apos;s most mysterious but extremely talented ad executives, Donald Draper.", "Drama", "0", "TV-MA", "advertising, 1960s, new york, drinking, chain smoking", "US", "91", "UP 4", "", "", "Jon Hamm, Elisabeth Moss, Vincent Kartheiser", "Jon Hamm, Elisabeth Moss, Vincent Kartheiser, January Jones", "", "", "", "", "New York City, New York, USA", "English", "Stereo", "1.78 : 1", "Color", "167", "450", "TV Series", "True", "False", "False"
"Suits", "8.4", "542440", "https://www.imdb.com/title/tt1632701/", "https://m.media-amazon.com/images/M/MV5BYmE4MmNjZjUtNTEyNy00NTZiLWE4NTktYjM2NjBhYzQ1N2IzXkEyXkFqcGc@._V1_.jpg", "On the run from a drug deal gone bad, brilliant college dropout Mike Ross finds himself working with Harvey Specter, one of New York City&apos;s best lawyers.", "Comedy, Drama", "0", "TV-14", "lawyer, new york city, photographic memory, paralegal, law firm", "US", "92", "UP 4", "", "", "Gabriel Macht, Patrick J. Adams, Meghan Markle", "Gabriel Macht, Patrick J. Adams, Meghan Markle, Rick Hoffman", "", "", "", "", "Toronto, Ontario, Canada", "English", "Dolby Digital", "1.78 : 1", "Color", "1", "9", "TV Series", "True", "False", "False"
"Rooster", "7.6", "18537", "https://www.imdb.com/title/tt32420734/", "https://m.media-amazon.com/images/M/MV5BOGEwYjMxNDctMDhlYy00YTJhLTk0YTAtOWVjOTJhYzIyZTEyXkEyXkFqcGc@._V1_.jpg", "A comedy revolving around an author&apos;s intricate bond with his daughter, set against the backdrop of a college campus.", "Comedy, Drama", "0", "TV-MA", "male rear nudity, male nudity, male protagonist, bare chested male, man wrapped in a towel", "US", "93", "UP 4", "", "", "Steve Carell, Danielle Deadwyler, Phil Dunster", "Steve Carell, Danielle Deadwyler, Phil Dunster, Charly Clive", "", "", "", "", "University of the Pacific, Stockton, California, USA", "English", "", "", "Color", "0", "0", "TV Series", "True", "False", "False"
"Outlander", "8.3", "202445", "https://www.imdb.com/title/tt3006802/", "https://m.media-amazon.com/images/M/MV5BMTc4M2JmYmEtMjJhOC00MmRlLThhZDEtMWRhZTZiNTI0ZDZhXkEyXkFqcGc@._V1_.jpg", "Honeymooning in 1945 Scotland, a combat nurse is suddenly transported back to the 1700s.", "Adventure, Drama, Fantasy", "0", "TV-MA", "scotland, scottish highlands, costume drama, time travel, year 1743", "US", "94", "DOWN 4", "", "", "Caitríona Balfe, Sam Heughan, Sophie Skelton", "Caitríona Balfe, Sam Heughan, Sophie Skelton, Richard Rankin", "", "", "", "USD 3,313", "Doune Castle, Doune, Stirling, Scotland, UK", "English, Gaelic", "Stereo, Dolby Digital", "1.78 : 1", "Color", "38", "95", "TV Series", "True", "False", "False"
"Daredevil: Born Again", "8.1", "110017", "https://www.imdb.com/title/tt18923754/", "https://m.media-amazon.com/images/M/MV5BNDBkMWRhMzEtM2M0Ny00OGZhLThkZGMtMTY1NWUwZWNhODdiXkEyXkFqcGc@._V1_.jpg", "Matt Murdock finds himself on a collision course with Wilson Fisk when their past identities begin to emerge.", "Action, Crime, Drama", "0", "TV-MA", "daredevil the marvel comics character, the punisher character, marvel shared universe, violence, marvel cinematic universe", "US", "95", "DOWN 8", "", "", "Charlie Cox, Hamish Allan-Headley, Vincent D'Onofrio", "Charlie Cox, Hamish Allan-Headley, Vincent D'Onofrio, Arty Froushan", "", "", "", "", "New York City, New York, USA", "English", "Dolby Atmos", "2.39 : 1", "Color", "1", "7", "TV Series", "True", "False", "False"
"The Terror", "7.8", "62499", "https://www.imdb.com/title/tt2708480/", "https://m.media-amazon.com/images/M/MV5BNWQxY2Q1NGItZTM5MS00M2EzLTg2MjgtNDQ5ZDBmMWY3ZWY2XkEyXkFqcGc@._V1_.jpg", "Supernatural, semihistorical horror anthology series, where each season is inspired by a different infamous or mysterious real-life historical tragedy.", "Adventure, Drama, Horror", "0", "TV-14", "psychological horror, historical fiction, failed mission, violence, cannibalism", "US", "96", "DOWN 19", "", "", "Jared Harris, Derek Mio, Tobias Menzies", "Jared Harris, Derek Mio, Tobias Menzies, Kiki Sukezane", "", "", "", "", "Island of Pag, Croatia", "English", "Stereo", "", "Color", "3", "19", "TV Series", "True", "False", "False"
"Law &amp; Order", "7.8", "51383", "https://www.imdb.com/title/tt0098844/", "https://m.media-amazon.com/images/M/MV5BMzgzYmZkZjctMmY3Yi00NWQwLTkxNGItNGNmYWMyZDQyNjViXkEyXkFqcGc@._V1_.jpg", "Two Part drama which focuses on the New York criminal Justice System by showing a violent crime investigated by police detectives in the first half and then the trial of the accused in court by the prosecutors in the second half.", "Crime, Drama, Mystery", "0", "TV-14", "1990s, shared universe, ampersand in title, punctuation in title, female police officer", "US", "97", "UP 6", "", "", "Jerry Orbach, Jesse L. Martin, Dennis Farina", "Jerry Orbach, Jesse L. Martin, Dennis Farina, Sam Waterston", "", "", "", "", "Katz's Delicatessen - 205 East Houston Street, East Village, Manhattan, New York City, New York, USA", "English", "Stereo", "1.78 : 1, 1.33 : 1", "Color", "50", "210", "TV Series", "True", "False", "False"
"Slow Horses", "8.3", "149063", "https://www.imdb.com/title/tt5875444/", "https://m.media-amazon.com/images/M/MV5BY2NkNTBiYWUtMGFiZS00MGI4LWE3YjMtZTU3NzhhZmEyYzlkXkEyXkFqcGc@._V1_.jpg", "A dysfunctional team of MI5 agents navigate the espionage world&apos;s smoke and mirrors to defend the UK from sinister forces.", "Drama, Thriller", "0", "TV-MA", "espionage, united kingdom, security service, intelligence operative, spook", "GB", "98", "UP 2", "", "", "Gary Oldman, Jack Lowden, Kristin Scott Thomas", "Gary Oldman, Jack Lowden, Kristin Scott Thomas, Saskia Reeves", "", "", "", "", "Mews, Old Royal Naval College, Greenwich, London, England, UK", "English", "Stereo", "2.00 : 1", "Color", "19", "111", "TV Series", "True", "False", "False"
"The Capture", "8", "34145", "https://www.imdb.com/title/tt8201186/", "https://m.media-amazon.com/images/M/MV5BODc5ZDRjNTgtY2I0My00YzNhLWE4NjItOTkwMjY5ODlkZDIwXkEyXkFqcGc@._V1_.jpg", "When a British soldier is charged with a crime, the tenacious young detective handling his case begins to uncover a conspiracy.", "Crime, Drama, Mystery", "0", "TV-MA", "conspiracy thriller, techno thriller, ex soldier, evidence, police investigation", "GB", "99", "UP 65", "", "", "Holliday Grainger, Lia Williams, Ben Miles", "Holliday Grainger, Lia Williams, Ben Miles, Ron Perlman", "", "", "", "", "", "English", "Stereo, Dolby Digital", "2.00 : 1", "Color", "0", "8", "TV Series", "True", "False", "False"
"Fallout", "8.3", "395961", "https://www.imdb.com/title/tt12637874/", "https://m.media-amazon.com/images/M/MV5BYzE1MTZmY2ItMTgxNi00OGU5LTk4NTItMmY2ODFhYzhjZjRkXkEyXkFqcGc@._V1_.jpg", "In a future, post-apocalyptic Los Angeles brought about by nuclear decimation, citizens must live in underground bunkers to protect themselves from radiation, mutants and bandits.", "Action, Adventure, Drama", "0", "TV-MA", "post apocalypse, based on video game, vault, fallout, live action video game adaptation", "US", "100", "UP 9", "", "", "Ella Purnell, Aaron Moten, Walton Goggins", "Ella Purnell, Aaron Moten, Walton Goggins, Moises Arias", "USD 153,000,000", "", "", "", "Kolmanskop, Sperrgebiet, Namibia", "English", "Dolby Atmos", "2.39 : 1", "Color", "15", "77", "TV Series", "True", "False", "False"
